{
  "protocol_version": "1.1.0",
  "project_id": "PROJ-001",
  "session_id": "SES-2026-05-22-001",
  "run_id": "RUN-2026-05-22-001",
  "analysis": {
    "request_type": "feature_delivery",
    "complexity": "medium",
    "is_clarification_required": false,
    "summary": "Потрібно пройти повний MVP цикл для auth flow: специфікація, реалізація, QA.",
    "risks": [
      "Без formal spec builder може переінтерпретувати scope.",
      "QA має перевіряти саме acceptance criteria, а не неявні очікування."
    ],
    "fallback_strategy": "Якщо будь-який агент повертає failed і retryable=false, PM зупиняє run або дробить задачу на менші task objects."
  },
  "execution_plan": {
    "mode": "sequential",
    "phases": [
      {
        "phase_id": "PHASE-1",
        "name": "Specification",
        "agents": ["spec_agent"],
        "goal": "Формалізувати вимоги і критерії приймання."
      },
      {
        "phase_id": "PHASE-2",
        "name": "Implementation",
        "agents": ["builder_agent"],
        "goal": "Побудувати MVP-артефакти для auth flow."
      },
      {
        "phase_id": "PHASE-3",
        "name": "Verification",
        "agents": ["qa_agent"],
        "goal": "Підтвердити відповідність артефактів spec."
      }
    ]
  },
  "tasks_to_dispatch": [
    {
      "protocol_version": "1.1.0",
      "project_id": "PROJ-001",
      "session_id": "SES-2026-05-22-001",
      "run_id": "RUN-2026-05-22-001",
      "task_id": "TASK-001",
      "parent_task_id": null,
      "step_id": "STEP-001",
      "state_version": 1,
      "retry_count": 0,
      "max_retries": 2,
      "agent": "spec_agent",
      "priority": "high",
      "status": "pending",
      "title": "Формалізувати auth flow requirements",
      "description": "Перетворити user request на machine-readable spec для MVP auth flow.",
      "depends_on": [],
      "input": {
        "requirements": [
          "Описати signup, login і refresh token flow",
          "Сформувати acceptance criteria для реалізації і QA"
        ],
        "context": {
          "product_stage": "mvp",
          "stack": ["Node.js", "Express", "PostgreSQL"],
          "business_goal": "швидко перевірити життєздатність auth flow"
        },
        "input_artifacts": []
      },
      "expected_output": {
        "artifact_types": ["spec"],
        "acceptance_criteria": [
          "Є feature summary",
          "Є user stories",
          "Є acceptance criteria",
          "Є open questions або явно вказано, що їх немає"
        ]
      },
      "constraints": {
        "max_tokens": 2500,
        "timeout_sec": 90,
        "do_not": [
          "Не проєктувати архітектуру",
          "Не генерувати production code"
        ]
      },
      "created_at": "2026-05-22T10:30:00+02:00"
    }
  ],
  "state_updates": {
    "state_version_increment": 1,
    "artifacts_to_attach": [],
    "decisions_to_record": [
      "Run стартує послідовно: spec -> builder -> qa"
    ],
    "tasks_to_mark_completed": [],
    "tasks_to_retry": []
  },
  "final_user_response": {
    "status": "in_progress",
    "message": "План побудовано, запускаємо specification stage.",
    "open_questions": []
  }
}